{
    "$schema": "https://json-schema.org/draft/2020-12/schema",
    "$id": "<TEMPLATE_SCHEMA_URL>",
    "title": "Azure Functions Template",
    "description": "A template in Azure Functions' v2 template schema",
    "type": "object",

    "properties": {
        "author": {
            "description": "The author of this template (author/maintainer/owner/contact)",
            "type": "string"
        },
        "name": {
            "description": "The name of this template; usually <Trigger> ex. 'HTTP Trigger'",
            "type": "string"
        },
        "description": {
            "description": "A short description of this template's trigger's functionality",
            "type": "string"
        },
        "programmingModel": {
            "description": "The programming model the template applies to",
            "enum": [ "v1", "v2" ]
        },
        "language": {
            "description": "The programming language the template applies to",
            "enum": [ "dotnet", "node", "python", "powershell" ]
        },
        "jobs": {
            "description": "The list of jobs defined by the template, each corresponding to a user gesture",
            "type": "array",
            "items": {
                "type": "object",
                "properties": {
                    "name": {
                        "description": "The display name of this job",
                        "type": "string"
                    },
                    "condition": {
                        "description": "The condition that must evaluate to true to run this job",
                        "name": {
                            "description": "The name of the variable to evaluate",
                            "type": "string"
                        },
                        "expectedValue": {
                            "description": "The value for which the condition is true",
                            "type": "string"
                        }
                    },
                    "input": {
                        "description": "The input provided to the job by the user gesture in the tooling",
                        "userCommand": {
                            "description": "The identifier for a job",
                            "type": "string"
                        },
                        "assignTo": {
                            "description": "Identifier to assign initial tooling-provided input to",
                            "type": "string",
                            "pattern": "\\$\\([A-Z0-9_]+\\"
                        }
                    },
                    "actions": {
                        "description": "Names of the actions the job executes in order of operation",
                        "items": { 
                            "oneOf": [ 
                                { "type": "string" },
                                { "$ref": "<ACTION_SCHEMA_URL>" }
                            ],
                        "minItems": 1
                        }
                    },
                    "required": [ "name", "input", "actions" ]
                },
            "minItems": 1,
            "uniqueItems": true
            }
        },
        "actions": {
            "description": "The list of action definitions used by jobs defined by a template",
            "type": "array",
            "items": { "$ref": "<ACTION_SCHEMA_URL>" },
            "minItems": 1,
            "uniqueItems": true
        }
    },
    "required": [ "author", "name", "description", "programmingModel", "language", "jobs", "actions" ]
}