{
    "author": "kashimiz",
    "name": "Timer trigger",
    "description": "$TimerTrigger_description",
    "programmingModel": "v2",
    "language": "python",
    "jobs": [
        {
            "name": "Create New Project with Timer Function",
            "type": "CreateNewApp",
            "inputs": [
                {
                    "assignTo": "$(APP_FILENAME)",
                    "paramId": "app-FileName",
                    "defaultValue": "function_app.py",
                    "required": true,
                    "condition" : {
                        "name": "ClientId",
                        "values": [ "VSCode"],
                        "operator": "IN"
                    }                    
                },
                {
                    "assignTo": "$(FUNCTION_NAME_INPUT)",
                    "paramId": "trigger-functionName",
                    "defaultValue": "timer_trigger"
                },                    
                {
                    "assignTo": "$(SCHEDULE_INPUT)",
                    "paramId": "timerTrigger-schedule",
                    "defaultValue": "0 */5 * * * *"
                }
            ],
            "actions": [
                "readFileContent_FunctionApp",
                "writeFile_FunctionApp",
                "showMarkdownPreview"
            ]
        },
        {
            "name": "Append Timer Function to File",
            "type": "AppendToFile",
            "inputs": [
                {
                    "assignTo": "$(SELECTED_FILEPATH)",
                    "paramId": "app-selectedFileName",
                    "defaultValue": "function_app.py",
                    "required": true,
                    "condition" : {
                        "name": "ClientId",
                        "values": [ "VSCode"],
                        "operator": "IN"
                    }
                },
                {
                    "assignTo": "$(FUNCTION_NAME_INPUT)",
                    "paramId": "trigger-functionName",
                    "defaultValue": "timer_trigger"
                },                    
                {
                    "assignTo": "$(SCHEDULE_INPUT)",
                    "paramId": "timerTrigger-schedule",
                    "defaultValue": "0 */5 * * * *"
                }
            ],
            "actions": [
                "readFileContent_FunctionBody",
                "appendFileContent_FunctionApp",
                "showMarkdownPreview"
            ]
        },
        {
            "name": "Create New Blueprint file",
            "type": "CreateNewBlueprint",
            "inputs": [
                {
                    "assignTo": "$(BLUEPRINT_FILENAME)",
                    "paramId": "blueprint-fileName",
                    "defaultValue": "blueprint.py",
                    "required": true,
                    "condition" : {
                        "name": "ClientId",
                        "values": [ "VSCode"],
                        "operator": "IN"
                    }
                },
                {
                    "assignTo": "$(FUNCTION_NAME_INPUT)",
                    "paramId": "trigger-functionName",
                    "defaultValue": "timer_trigger"
                },                    
                {
                    "assignTo": "$(SCHEDULE_INPUT)",
                    "paramId": "timerTrigger-schedule",
                    "defaultValue": "0 */5 * * * *"
                }
            ],
            "actions": [
                "readFileContent_BlueprintFile",
                "writeFile_BlueprintFile",
                "readFileContent_BlueprintBody",
                "appendFileContent_BlueprintBody"
            ]
        },
        {
            "name": "Add TimerTrigger function to the Blueprint",
            "type": "AppendToBlueprint",
            "inputs": [
                {
                    "assignTo": "$(BLUEPRINT_FILENAME)",
                    "paramId": "blueprint-existingFileName",
                    "required": true,
                    "condition" : {
                        "name": "ClientId",
                        "values": [ "VSCode"],
                        "operator": "IN"
                    }
                },
                {
                    "assignTo": "$(FUNCTION_NAME_INPUT)",
                    "paramId": "trigger-functionName",
                    "defaultValue": "timer_trigger"
                },                    
                {
                    "assignTo": "$(SCHEDULE_INPUT)",
                    "paramId": "timerTrigger-schedule",
                    "defaultValue": "0 */5 * * * *"
                }
            ],
            "actions": [
                "readFileContent_BlueprintBody",
                "appendFileContent_BlueprintBody"
            ]
        }
    ],
    "actions": [
        {
            "name": "readFileContent_FunctionApp",
            "type": "GetTemplateFileContent",
            "assignTo": "$(FUNCTION_APP)",
            "filePath": "function_app.py"
        },
        {
            "name": "readFileContent_FunctionBody",
            "type": "GetTemplateFileContent",
            "assignTo": "$(TIMER_FUNCTION_BODY)",
            "filePath": "function_body.py"
        },
        {
            "name": "appendFileContent_FunctionApp",
            "type": "AppendToFile",
            "createIfNotExists": false,
            "source": "$(TIMER_FUNCTION_BODY)",
            "filePath": "$(SELECTED_FILEPATH)",
            "continueOnError": false,
            "errorText": "Unable to create httpTrigger function",
            "replaceTokens": true,
            "FileExtension": ".py"
        },
        {
            "name": "replaceText_FunctionBody",
            "type": "ReplaceTokensInText",
            "assignTo": "$(TIMER_FUNCTION_BODY)",
            "source": "$(TIMER_FUNCTION_BODY)"
        },
        {
            "name": "showMarkdownPreview",
            "type": "ShowMarkdownPreview",
            "filePath": "timer_trigger_template.md"
        },
        {
            "name": "writeFile_FunctionApp",
            "type": "WriteToFile",
            "filePath": "$(APP_FILENAME)",
            "source": "$(FUNCTION_APP)",
            "replaceTokens": true,
            "FileExtension": ".py"
        },
        {
            "name": "readFileContent_BlueprintBody",
            "type": "GetTemplateFileContent",
            "assignTo": "$(BLUEPRINT_BODY_CONTENT)",
            "filePath": "blueprint_body.py"
        },
        {
            "name": "readFileContent_BlueprintFile",
            "type": "GetTemplateFileContent",
            "assignTo": "$(BLUEPRINT_CONTENT)",
            "filePath": "blueprint.py"
        },
        {
            "name": "appendFileContent_BlueprintBody",
            "type": "AppendToFile",
            "source": "$(BLUEPRINT_BODY_CONTENT)",
            "filePath": "$(BLUEPRINT_FILENAME)",
            "continueOnError": false,
            "errorText": "Unable to create the Blueprint",
            "replaceTokens": true,
            "FileExtension": ".py"
        },
        {
            "name": "writeFile_BlueprintFile",
            "type": "WriteToFile",
            "source": "$(BLUEPRINT_CONTENT)",
            "filePath": "$(BLUEPRINT_FILENAME)",
            "continueOnError": false,
            "errorText": "Unable to create blueprint",
            "replaceTokens": true,
            "FileExtension": ".py"
        }
    ]
}
