{
    "author": "Ashique",
    "name": "Dapr Service Invocation trigger",
    "description": "$DaprServiceInvocationTrigger_description",
    "programmingModel": "v2",
    "language": "python",
    "jobs": [
        {
            "name": "Create New Project with DaprServiceInvocationTrigger function",
            "type": "CreateNewApp",
            "inputs": [
                {
                    "assignTo": "$(APP_FILENAME)",
                    "paramId": "app-fileName",
                    "defaultValue": "function_app.py",
                    "required": true,
                    "condition" : {
                        "name": "ClientId",
                        "values": [ "VSCode"],
                        "operator": "IN"
                    }
                },
                {
                    "assignTo": "$(FUNCTION_NAME_INPUT)",
                    "paramId": "trigger-functionName",
                    "required": true,
                    "defaultValue": "dapr_service_invocation_trigger"
                }
            ],
            "actions": [
                "readFileContent_FunctionApp",
                "writeFile_FunctionApp",
                "showMarkdownPreview"
            ]
        },
        {
            "name": "Add DaprServiceInvocationTrigger function to the main file",
            "type": "AppendToFile",
            "inputs": [
                {
                    "assignTo": "$(SELECTED_FILEPATH)",
                    "paramId": "app-selectedFileName",
                    "defaultValue": "function_app.py",
                    "required": true,
                    "condition" : {
                        "name": "ClientId",
                        "values": [ "VSCode"],
                        "operator": "IN"
                    }
                },
                {
                    "assignTo": "$(FUNCTION_NAME_INPUT)",
                    "paramId": "trigger-functionName",
                    "required": true,
                    "defaultValue": "dapr_service_invocation_trigger"
                }
            ],
            "actions": [
                "readFileContent_FunctionBody",
                "appendFileContent_FunctionApp"
            ]
        },
        {
            "name": "Create New Blueprint file",
            "type": "CreateNewBlueprint",
            "inputs": [
                {
                    "assignTo": "$(APP_FILENAME)",
                    "paramId": "app-fileName",
                    "defaultValue": "blueprint.py",
                    "required": true,
                    "condition" : {
                        "name": "ClientId",
                        "values": [ "VSCode"],
                        "operator": "IN"
                    }
                },
                {
                    "assignTo": "$(FUNCTION_NAME_INPUT)",
                    "paramId": "trigger-functionName",
                    "required": true,
                    "defaultValue": "dapr_service_invocation_trigger"
                }
            ],
            "actions": [
                "readFileContent_BlueprintFile",
                "writeFile_BlueprintFile",
                "readFileContent_BlueprintBody",
                "appendFileContent_BlueprintBody"
            ]
        },
        {
            "name": "Add DaprServiceInvocationTrigger function to the Blueprint",
            "type": "AppendToBlueprint",
            "inputs": [
                {
                    "assignTo": "$(APP_FILENAME)",
                    "paramId": "app-fileName",
                    "required": true,
                    "condition" : {
                        "name": "ClientId",
                        "values": [ "VSCode"],
                        "operator": "IN"
                    }
                },
                {
                    "assignTo": "$(FUNCTION_NAME_INPUT)",
                    "paramId": "trigger-functionName",
                    "required": true,
                    "defaultValue": "dapr_service_invocation_trigger"
                }
            ],
            "actions": [
                "readFileContent_BlueprintBody",
                "appendFileContent_BlueprintBody"
            ]
        }
    ],
    "actions": [
        {
            "name": "readFileContent_FunctionApp",
            "type": "GetTemplateFileContent",
            "assignTo": "$(FUNCTION_APP_CONTENT)",
            "filePath": "function_app.py"
        },
        {
            "name": "writeFile_FunctionApp",
            "type": "WriteToFile",
            "source": "$(FUNCTION_APP_CONTENT)",
            "filePath": "$(APP_FILENAME)",
            "continueOnError": false,
            "errorText": "Unable to create the function app",
            "replaceTokens": true,
            "FileExtension": ".py"
        },
        {
            "name": "readFileContent_FunctionBody",
            "type": "GetTemplateFileContent",
            "assignTo": "$(FUNCTION_BODY)",
            "filePath": "function_body.py"
        },
        {
            "name": "appendFileContent_FunctionApp",
            "type": "AppendToFile",
            "createIfNotExists": false,
            "source": "$(FUNCTION_BODY)",
            "filePath": "$(SELECTED_FILEPATH)",
            "continueOnError": false,
            "errorText": "Unable to create dapr service invocation trigger function",
			"replaceTokens": true,
            "FileExtension": ".py"
        },
        {
            "name": "ShowMarkdownPreview",
            "type": "ShowMarkdownPreview",
            "filePath": "dapr_service_invocation_trigger_template.md"
        },
        {
            "name": "readFileContent_BlueprintFile",
            "type": "GetTemplateFileContent",
            "assignTo": "$(BLUEPRINT_CONTENT)",
            "filePath": "blueprint.py"
        },
        {
            "name": "writeFile_BlueprintFile",
            "type": "WriteToFile",
            "source": "$(BLUEPRINT_CONTENT)",
            "filePath": "$(BLUEPRINT_FILENAME)",
            "continueOnError": false,
            "errorText": "Unable to create blueprint",
            "replaceTokens": true,
            "FileExtension": ".py"
        },
        {
            "name": "readFileContent_BlueprintBody",
            "type": "GetTemplateFileContent",
            "assignTo": "$(BLUEPRINT_BODY_CONTENT)",
            "filePath": "blueprint_body.py"
        },
        {
            "name": "appendFileContent_BlueprintBody",
            "type": "AppendToFile",
            "source": "$(BLUEPRINT_BODY_CONTENT)",
            "filePath": "$(BLUEPRINT_FILENAME)",
            "continueOnError": false,
            "errorText": "Unable to create the Blueprint",
            "replaceTokens": true,
            "FileExtension": ".py"
        }
    ]
}